<?xml version="1.0" encoding="utf-8"?>
<xs:schema id="navigator-definition" 
xmlns="" 
xmlns:xs="http://www.w3.org/2001/XMLSchema" 
xmlns:msdata="urn:schemas-microsoft-com:xml-msdata"
targetNamespace="http://www.serpicsframework.org/schema/smc">
  <xs:element name="navigator-definition" msdata:IsDataSet="true" msdata:UseCurrentLocale="true">
    <xs:complexType>
      <xs:choice minOccurs="0" maxOccurs="unbounded">
        <xs:element name="navigator">
          <xs:complexType>
            <xs:sequence>
              <xs:element name="navigator-item" minOccurs="0" maxOccurs="unbounded">
                <xs:complexType>
                  <xs:attribute name="allow-child" type="xs:boolean" />
                  <xs:attribute name="bean" type="xs:string" />
                  <xs:attribute name="name" type="xs:string" />
                  <xs:attribute name="parent" type="xs:string" />
                </xs:complexType>
              </xs:element>
            </xs:sequence>
            <xs:attribute name="name" type="xs:string" />
          </xs:complexType>
        </xs:element>
      </xs:choice>
    </xs:complexType>
  </xs:element>
</xs:schema>